CD06,UBRIQUE,Nos situamos en el centro de Ubrique y salimos por la A-373 en dirección hacia El Bosque y Ronda.,"En el km. 1,7 giramos a la derecha por la A-2302 hacia Benaocaz y Ronda; durante la ascensión pasamos al lado de Benaocaz y Villaluenga del Rosario.","1,5 kms. después de Villaluenga, en un collado sin señal ni referencia.",,36.70516,-5.37297,"https://maps.google.es/maps/ms?msa=0&msid=201849215099252397790.0004f8d717c7640957ae3&hl=es&ie=UTF8&t=m&ll=36.690446,-5.415573&spn=0.110121,0.171318&z=12&output=embed"
LL20,ALSAMORA,"Situándonos en Puente de Montañana, tomar la carretera que va hacia Alsamora siempre al lado del río Noguera Ribagorzana. La subida comenzaría poco después de pasar el cruce de La Clua.","Llegando a Alsamora, el nuevo trazado de la carretera nos evita entrar en este pueblo. Poco después, habrá que estar atento a tomar un desvío hacia la derecha.","500 mts. antes de llegar al final, veremos el desvío a la derecha hacia el Observatorio Astronómico. Una vez en el collado, aún podemos buscar un punto más alto si seguimos por la izquierda y recorremos 400 mts. más hasta llegar al final del asfalto, lugar donde frecuentemente se practica el parapente.",Asfalto malo (2016),42.04827,0.74268,"https://maps.google.es/maps/ms?msa=0&msid=201849215099252397790.0004f9b0ce195ca9c4dd7&hl=es&ie=UTF8&t=m&ll=42.066371,0.729218&spn=0.101949,0.171318&z=12&output=embed"
CA19,LOS LLARES,"Transitando por la N-611 desde Corrales de Buelna hacia Arenas de Iguña y Reinosa, encontraremos un desvío que nos lleva a San Vicente de León y Las Fraguas. Desde aquí la carretera va ganando metros ligeramente pero será en Los Llares donde podemos considerar el inicio de la ascensión, al paso por la parada de autobús.",En un cruce,"a la derecha se baja hacia Villasuso de Cieza por la otra vertiente, y a la izquierda sale una pista de tierra. Por esta pista, a 200 mts., hay un cartel de madera con el nombre del alto.",,43.20527,-4.14882,"https://maps.google.es/maps/ms?msa=0&msid=201849215099252397790.0004f8d5ec7d01d2f40a6&hl=es&ie=UTF8&t=m&ll=43.191911,-4.127083&spn=0.050061,0.085659&z=13&output=embed"
CC09,GUADALUPE,"En la rotonda donde se separan la EX-102 que va de Miajadas a Alía y la EX-118 que se dirige a Guadalupe y Navalmoral de la Mata. Tenemos dos opciones, rodear Guadalupe por el este, o meternos por esta localidad y cruzarla por el oeste.","En cualquiera de las dos opciones, pasado Guadalupe seguimos por la EX-118 hacia Navalmoral de la Mata; 3,5 kms. después de dejar Guadalupe, hallaremos un cruce","a la derecha subíría a la ermita del Humilladero y a la izquierda es por donde debemos seguir, hacia la Base Militar;sobre el km. 14 de ascensión, nos uniremos a la carretera que viene de Navezuelas, de la otra vertiente de Acebadillas.","Asfalto pésimo, muy difícil para ruedas finas en los últimos kilómetros.",39.46939,-5.40192,"https://maps.google.es/maps/ms?msa=0&msid=201849215099252397790.0004f7c562c559726cdef&hl=es&ie=UTF8&t=m&ll=39.460848,-5.364418&spn=0.106026,0.171318&z=12&output=embed"
CA19,VILLASUSO DE CIEZA,"Transitando por la N-611 desde Corrales de Buelna hacia Arenas de Iguña y Reinosa, encontraremos un desvío que nos lleva a Villasuso de Cieza. Saliendo de esta población hacia el oeste, iniciamos el ascenso.",En un cruce,"a la izquierda se baja hacia Las Fraguas por la otra vertiente, y a la derecha sale una pista de tierra. Por esta pista, a 200 mts., hay un cartel de madera con el nombre del alto.",,43.20527,-4.14882,"https://maps.google.es/maps/ms?msa=0&msid=201849215099252397790.0004f8d5e5897563bc9ab&hl=es&ie=UTF8&t=m&ll=43.213058,-4.134207&spn=0.025022,0.04283&z=14&output=embed"
LE09,HERRERÍAS,"En la N-VI entre Vega de Valcarce y Piedrafita de Cebreiro, tomamos el desvío para entrar en Las Herrerías de Valcarce. Justo al entrar en este pueblo iniciamos la ascensión, cruzando un puente sobre el río.","Siguiendo siempre el Camino de Santiago, a los 3,7 kms. giraremos a la derecha hacia La Laguna, dejando la que continua recto hacia La Faba; y sobre el km. 8,5 desde el punto inicial, un cruce","a la izquierda va a Cebreiro, de frente sale a la LU-633 donde está el cartel de puerto, y nosotros elegimos la de la derecha hacia unas antenas.",,42.7127,-7.02618,"https://maps.google.es/maps/ms?msa=0&msid=201849215099252397790.0004f853d4f717ba9091e&hl=es&ie=UTF8&t=m&ll=42.68824,-7.014771&spn=0.100944,0.171318&z=12&output=embed"
TA09,RIERA DEL COMTE (C-42),"En la C-12 entre Ginestar y Rasquera, cuando pasamos sobre el puente de la Riera del Comte, en dirección a Rasquera.","A los 2,2 kms. giramos a la izquierda hacia Rasquera y El Perelló; vamos siguiendo las indicaciones para entrar en Rasquera y una vez estemos cruzando por sus calles, veremos la continuación hacia Cardó pasando a la izquierda de una fuente de forma circular.","A las puertas del abandonado Balneario de Cardó, se acaba el asfalto y comienza una pista de tierra hacia Ermitori de la Vall de Cardó.",,40.95172,0.57762,"https://maps.google.es/maps/ms?msa=0&msid=201849215099252397790.0004f6c8160ed3bc2fdb3&ie=UTF8&t=m&ll=40.987155,0.589485&spn=0.103664,0.171318&z=12&output=embed"
MU04,LORCA,"Salimos de Lorca por la D-7 hacia Mazarrón, Morata, Puntas de Calnegre y Campico López; poco después, se convierte en la D-8, siguiendo siempre las indicaciones de Morata-Campico López; pasada una gasolinera ""La Balsica"", llegamos a un cruce que por la derecha viene de Águilas","aquí podemos considerar el inicio de la subida, continuando hacia Morata-Campico López.","A los 6,3 kms. en el cruce seguimos hacia Campico López, dejando la que va a Morata a la izquierda.",,37.55763,-1.56468,"https://maps.google.es/maps/ms?msa=0&msid=218028416192983371638.0004f7b89160d7c808b06&hl=es&ie=UTF8&t=m&ll=37.607976,-1.580658&spn=0.108793,0.171318&z=12&output=embed"
MU10,TOTANA / LA SANTA,"Salimos de Totana, desde la N-340, buscando la MU-502 que se dirige hacia Aledo.","En el km. 1,6 saliendo de Totana, seguimos por la derecha hacia La Santa y Aledo; en el km. 7,7 justo llegando a la ermita de Santa Eulalia (La Santa), tenemos dos opciones","A) giramos a la derecha hacia donde indica Casa las Monjas y Casas Rurales; en el km. 9,6 alcanzamos la carretera MU-503 que por la izquierda viene de Aledo (opción B) y seguimos rectos hacia Zarzadilla de Totana y Bullas; en el km. 11,5 giramos a la derecha hacia El Parque Regional de Sierra Espuña y EVA-13; finalmente, en el km. 18,8 llegamos al Collado Bermejo y giramos a la izquierda hacia el Morrón donde está situado el EVA-13. B) seguimos rectos pasando por delante de La Santa; en el km. 10,4 llegamos a Aledo y en dos rotondas casi seguidas seguimos la indicación a Zarzadilla de Totana; en el km. 11,9 nos llega por la derecha la opción A; en el km. 13,8 giramos a la derecha hacia El Parque Regional de Sierra Espuña y EVA-13; finalmente, en el km. 21,0 llegamos al Collado Bermejo y giramos a la izquierda hacia el Morrón donde está situado el EVA-13.",,37.86231,-1.57345,"https://maps.google.es/maps/ms?msa=0&msid=218028416192983371638.0004f7b7fb78b0e43766a&hl=es&ie=UTF8&t=m&ll=37.817921,-1.542892&spn=0.108485,0.171318&z=12&output=embed"
OU06,MONTEFURADO / POBRA DE TRIVES,"Abandonamos la N-120 entre A Rúa y Monforte en la salida de Montefurado; poco después seguimos hacia la Central Hidroeléctrica de Montefurado y pasamos por la aldea de Os Casares, y siguiendo el curso del río Bibei llegaremos al punto de inicio de la subida, un puente sobre el río Návea, en el cruce que a la derecha va a Návea; seguiremos hacia Pobra de Trives. [ Mismo inicio que el OU12 O Cerengo ]","En el km. 9,2 entramos en A Pobra de Trives y tenemos dos opciones","A) girar a la izquierda y en 300 mts. seguir la indicación a la Estación Invernal de Manzaneda por la OU-0703 o B) girar a la derecha hacia Ourense y en 700 mts. desviarse a la izquierda hacia San Mamede y Pareisas; en cualquiera de las dos opciones alcazaremos el pueblo de Cova y poco después giraremos a la izquierda hacia Cabeza de Manzaneda, dejando a la derecha la carretera que va a Chandrexa de Queixa; sobre el km. 25,6 un poco antes de llegar a las instalaciones inferiores de la Estación Invernal, giraremos a la derecha para dirigirnos a las antenas e instalaciones superiores.",,42.25827,-7.30003,"https://maps.google.es/maps/ms?msa=0&msid=201849215099252397790.0004f8095f03d7ba7e92b&hl=es&ie=UTF8&t=m&ll=42.314893,-7.266083&spn=0.203098,0.342636&z=11&output=embed"
AV13,PUENTE DEL MORISCO,"En la AV-913 que comunica Burgohondo con Serranillos, empezamos la subida al cruzar el río Alberche en el Puente del Morisco hacia Navarrevisca. [ Mismo inicio que el AV04 Serranillos por Puente del Morisco y AV14 La Erilla ]","En los cruces que nos irán apareciendo, no dejar nunca la AV-913 dirección Serranillos; en el km. 9,7 tomamos las pista asfaltada que nos sale a la izquierda, de asfalto gastado, sin señal ninguna.","Acaba cerca de la ermita de San Pedro; hay un cartel de Burum. El final del asfalto, en descenso, llega hasta unas antenas.",Asfalto malo (2013),40.34688,-4.88082,"https://maps.google.es/maps/ms?msa=0&msid=201849215099252397790.0004f8a3f000387d00d4e&hl=es&ie=UTF8&t=m&ll=40.366166,-4.85733&spn=0.104634,0.171318&z=12&output=embed"
AV14,PUENTE DEL MORISCO,"En la AV-913 que comunica Burgohondo con Serranillos, empezamos la subida al cruzar el río Alberche en el Puente del Morisco hacia Burgohondo. [ Mismo inicio que el AV04 Serranillos por Puente del Morisco y AV13 Ermita de San Pedro - La Mesa ]","En el km. 0,5 giramos a la izquierda entrando en el Barrio del Morisco; en el km. 4,8 giramos a la izquierda (la de la derecha viene de Burgohondo); en el km. 5,6 volvemos a girar a la izquierda, hacia Navatalgordo, por la AV-905; en el km. 7,6 giramos a la derecha por la AV-P-416 hacia Navaquesera; en el km. 12,7 justo al entrar en Navaquesera, nos desviamos a la derecha hacia Hoyocasero por pista de hormigón.","Acaba sin nada que sirva de referencia, un final irregular que se presta a dudas. Más o menos, 4 kms. después de dejar atrás Navaquesera.",,40.41776,-4.95492,"https://maps.google.es/maps/ms?msa=0&msid=201849215099252397790.0004f8a3e77f4d8d042be&hl=es&ie=UTF8&t=m&ll=40.409836,-4.897156&spn=0.104566,0.171318&z=12&output=embed"
OU11,VILOIRA,"Dejamos la N-120 en O Barco, y cruzando el río Sil, comenzará la ascensión buscando la OU-121 hacia Santigoso y Prada.","Recorridos 15 kms. de la OU-121 se llega al alto de A Portela, y giramos a la izquierda hacia Lamalonga y el Alto da Moeda o Moneda.",Actualmente (2013) tiene un cartel de madera del artista Buru.,,42.34606,-6.96221,"https://maps.google.es/maps/ms?msa=0&msid=201849215099252397790.0004f80c78b20ab9ea904&hl=es&ie=UTF8&t=m&ll=42.376554,-6.983185&spn=0.101449,0.171318&z=12&output=embed"
AS28,VENTA NUEVA,"En la AS-15 entre Cangas de Narcea y Degaña, al cruzar el río Muniellos al entrar en Venta Nueva.",En la boca del túnel de Rañadoiro. NOTA,"Actualmente esta carretera ha sido desmantelada, ya no es posible transitar por ella. Algunos tramos están ya enterrados.",,42.99547,-6.62105,"https://maps.google.es/maps/ms?msa=0&msid=201849215099252397790.0004f7c89dc24ce47eee9&hl=es&ie=UTF8&t=m&ll=43.021467,-6.623039&spn=0.100401,0.171318&z=12&output=embed"
BI07,MAÑARIA,De Durango salimos por la BI-623 hacia Vitoria y comenzamos la ascensión al paso por Mañaria.,"Alcanzado el alto de Urkiola, giramos a la izquierda hacia el Santuario. ATENCIÓN","actualmente las señales de tráfico, que hemos de respetar como usuarios de la carretera, prohiben girar a la izquierda; nos obligan, alcanzado el alto de Urkiola, a bajar 200 mts. hacia Vitoria para cambiar de sentido y al volver a subir girar a la derecha hacia el Santuario. Quien gire a la izquierda al coronar Urkiola ha de cuidar este detalle bajo su responsabilidad.",,43.10009,-2.64416,"https://maps.google.es/maps/ms?msa=0&msid=201849215099252397790.0004f96e1bcc522205aa4&hl=es&ie=UTF8&t=m&ll=43.116648,-2.650795&spn=0.050123,0.085659&z=13&output=embed"
CS14,ESLIDA,"Aunque desde que dejamos la CV-10 antes de Artana, la carretera ya empieza a subir ligeramente, pondremos el inicio en la localidad de Eslida tomando dirección Ain por la CV-223. [ Mismo inicio que el CS10 Eslida (antenas)-Puntal L'Aljub ]","A los 5,5 kms desde Eslida encontraremos un cruce, tomaremos a la izquierda hacia Almedíjar y Segorbe.",Actualmente tiene un cartel de madera de Buru indicando el punto más alto.,,39.89028,-0.35927,"https://maps.google.es/maps/ms?msa=0&msid=201849215099252397790.0004f96cb51f6476f3c44&hl=es&ie=UTF8&t=m&ll=39.89288,-0.33371&spn=0.052683,0.085659&z=13&output=embed"
CS14,TALES,Salimos de Tales hacia L'Alcudia de Veo y Algimia de Almonacid por la CV-223.,"A los 6,9 seguimos por la izquierda hacia Aín y Artana, dejando a la derecha la carretera que va a Algimia y Segorbe; en el km. 11,0 nos desviamos hacia Almedíjar a la derecha por la CV-200, ignorando la izquierda que va a Aín y Eslida.",Actualmente tiene un cartel de madera de Buru indicando el punto más alto.,,39.89028,-0.35927,"https://maps.google.es/maps/ms?msa=0&msid=201849215099252397790.0004f96cba7afd6def207&hl=es&ie=UTF8&t=m&ll=39.922376,-0.330276&spn=0.10532,0.171318&z=12&output=embed"
SO08,PÓVEDA DE SORIA,"Aunque desde Almarza, en la N-111 que une Soria con Logroño, ya se va ascendiendo ligeramente, consideraremos lo más interesante de la subida a partir de cruzar el río de Pinar, a la entrada de La Póveda de Soria.",No creo que nadie se equivoque pero no está de más decirlo,"actualmente un túnel cruza el puerto a una cota más baja; cuando llevemos algo más de 3 kms. desde La Póveda de Soria, veremos que nos indican la continuación, a la derecha, para acceder al Puerto de Piqueras.",,42.05554,-2.5377,"https://maps.google.es/maps/ms?msa=0&msid=201849215099252397790.0004f8a3904db9c49404e&hl=es&ie=UTF8&t=m&ll=42.030934,-2.514839&spn=0.102006,0.171318&z=12&output=embed"
AC04,A RIBEIRA DO FREIXO,"Partiremos desde el Concello de Outes, concretamente desde A Ribeira do Freixo, desde la AC-550, donde cogeremos a nuestra derecha (si vamos en dirección a Muros) el desvío hacia Valadares y Arestiño. Todo esto se encuentra al suroeste de la provincia, concretamente en la orilla norte de la ría de Muros y Noia.",En la localidad de Magor giramos a la derecha hacia el Parque Eólico.,"Al acabarse el asfalto, junto a un aerogenerador, giramos a la derecha y 200 mts. de pista de tierra nos acercarán hasta el vértice geodésido de Tremuzo, final de la ruta.",,42.82691,-8.95332,"https://maps.google.es/maps/ms?msa=0&msid=218028416192983371638.0004b91a2a8ba3c1c22cf&hl=es&ie=UTF8&t=m&ll=42.810137,-8.954887&spn=0.050373,0.085659&z=13&output=embed"
ML13,RÍO GENAL / PUJERRA,"En la pista asfaltada que une Júzcar con Pujerra, al cruzar el río Genal en dirección a Pujerra.","En el km. 3,5 seguimos a Pujerra a la derecha, ignorando la izquierda que nos llevaría a Igualeja; al llegar a Pujerra, tomar la ronda a la izquierda que nos evita el paso por el estrecho callejeo del pueblo; al salir del pueblo, nuevamente izquierda para enfilar hacia el Puerto de El Monte; en el km. 12,3 coronamos el Puerto de El Monte, sin cartel.","Al alcanzar la A-397 de Ronda a San Pedro de Alcántara, junto al cartel de puerto de El Madroño.",,36.61184,-5.07431,"https://maps.google.es/maps/ms?msa=0&msid=201849215099252397790.0004f76ad0f188e29a20a&hl=es&ie=UTF8&t=m&ll=36.60478,-5.112419&spn=0.110243,0.171318&z=12&output=embed"
LU22,CABACEIRA,"Tomamos la LU-4606 que va de Chao de Pousadoiro hacia Fonsagrada y Santalla, y a la altura de Os Cangos, nos desviamos hacia Fonsagrada y Vilares. Comenzaría la ascensión al cruzar un puente sobre el río Rodil.","Transitamos en todo momento por la LU-1906, cruzaremos Cabaceira, Vilares, y a los 11,4 kms. llegaremos al alto de Hospital.","Al coronar se aprecia un cartel azul que señala al centro reemisor de la TVG, que tomaremos para alcanzar las antenas de Lagoseca. VARIANTE",,43.10642,-7.13699,"https://maps.google.es/maps/ms?msa=0&msid=201849215099252397790.0004f77f5dca42dd04de9&hl=es&ie=UTF8&t=m&ll=43.140076,-7.172356&spn=0.100207,0.171318&z=12&output=embed"
JA10,PUENTE ORTEGA,"En la carretera A-6202 que desde el Embalse Tranco de Beas se dirige a Villanueva del Arzobispo, a la altura del km. 8,700 podemos dar inicio a esta subida, junto a una venta, en dirección a Villanueva del Arzobispo.","En el km. 8,2 pasamos por encima de la N-322 y seguimos las indicaciones a Villanueva del Arzobispo; una vez dejamos Villanueva a la derecha, un cruce en el km. 10,6 continuamos a la izquierda hacia Villacarrillo; en el km. 11,7 dejamos la rotonda por la primera salida ya con la indicación hacia Iznatoraf.","Al entrar en el pueblo de Iznatoraf, seguimos la pendiente ascendente girando hacia la izquierda y podemos acabar en un parking con amplio mirador.",,38.15716,-3.034,"https://maps.google.es/maps/ms?msa=0&msid=201849215099252397790.0004f9ed9a013019d0cbf&ie=UTF8&t=m&ll=38.150487,-2.995148&spn=0.107994,0.171318&z=12&output=embed"
JA10,MOGÓN,Salimos de Mogón por la carretera que lleva a Villanueva del Arzobispo. Poco después de cruzar un sencillo puente comienza la ascensión.,"En el km. 9,5 pasamos bajo la N-322, accedemos a una rotonda y seguimos las indicaciones a Iznatoraf.","Al entrar en el pueblo de Iznatoraf, seguimos la pendiente ascendente girando hacia la izquierda y podemos acabar en un parking con amplio mirador.",Asfalto malo (2013),38.15716,-3.034,"https://maps.google.es/maps/ms?msa=0&msid=218028416192983371638.0004f7b1fa408d5de2752&hl=es&ie=UTF8&t=m&ll=38.116191,-3.027763&spn=0.108045,0.171318&z=12&output=embed"
BI02,AREATZA,"Nos situamos en la plaza del pueblo de Areatza. Hemos de iniciar nuestras pedaladas buscando las indicaciones de Gorbea, del refugio de Larreder y Pagomakurre.","Sobre el km. 7,0 llegaremos a las campas de Larreder, con un aparcamiento, pero hemos de seguir adelante.","Al final de la pista cementada, en un gran aparcamiento donde se bifurcan sendas pistas de tierra, hay un cartel que indica que nos encontramos en el Área de Pagomakurre.",,43.077869,-2.791504,"https://maps.google.es/maps/ms?msa=0&msid=201849215099252397790.0004f96ede65e3501ec01&hl=es&ie=UTF8&t=m&ll=43.098476,-2.780399&spn=0.050138,0.085659&z=13&output=embed"
ZM03,SAN MARTÍN,"En la ZA-104 que une La Puebla de Sanabria y Ribadelago, después de Galende tomamos el desvío hacia San Martín de Castañeda por la ZA-103. La subida comienza al cruzar el río Tera.",El pueblo de San Martín puede rodearse cómodamente por la carretera ZA-103 o se puede callejear buscando algunas rampas más duras,al gusto del cicloturista.,,42.16955,-6.7345,"https://maps.google.es/maps/ms?msa=0&msid=201849215099252397790.0004f81a21037974251de&hl=es&ie=UTF8&t=m&ll=42.135913,-6.7099&spn=0.101837,0.171318&z=12&output=embed"
PR13,FUNCHAL,"Comenzamos en el paseo marítimo de Funchal, en la rotonda Sa Carneiro, saliendo en dirección NW.",Callejeando por Funchal buscaremos la carretera ER107 que se dirige a Curral das Freiras.,Al llegar a la boca del túnel en el km. 11 giramos a la izquierda por la antigua carretera hasta el parking del hotel Eira do Serrado. Tiene cartel de puerto.,,32.71041,-16.96223,"https://maps.google.com/maps/ms?msa=0&msid=201849215099252397790.0004f78c3a720bb952c80&hl=es&ie=UTF8&t=m&ll=32.679841,-16.941605&spn=0.11559,0.171318&z=12&output=embed"
MU08,RICOTE,"Salimos de Ojós hacia Blanca por la MU-520 y al poco de dejar las últimas casas, tomamos el desvío hacia Ricote a la izquierda.",El entrar en Ricote seguimos las indicaciones a La Bermeja.,"Al llevar 5 kms. desde el punto de inicio, cruzaremos el llamado Puente Saltador Martín, y 700 mts. después coronamos, junto al hito del km. 3. NOTA",,38.14752,-1.38483,"https://maps.google.es/maps/ms?msa=0&msid=218028416192983371638.0004f7b8307cf84b51638&hl=es&ie=UTF8&t=m&ll=38.149408,-1.361103&spn=0.053998,0.085659&z=13&output=embed"
AB06,CM-3216 (SUR),"En la carretera CM-3216 entre Paterna de Madera y Ayna, empieza la subida en el desvío hacia Peñascosa.","Pasaremos durante la subida por tres desvíos, en los tres seguiremos recto, dejando a la derecha, consecutivamente, El Ático, Los Catalmerejos y El Berrueco.","Al no tener un cartel ni elemento significativo, ofrece muchas dudas, siendo además el final muy irregular, sin bajada hacia el otro lado, con varios repechos. Hemos de vigilar que hayamos recorrido 8,1 kms. desde que empezamos la subida.",,38.65402,-2.32668,"https://maps.google.es/maps/ms?msa=0&msid=201849215099252397790.0004f8fa3d7038118e190&hl=es&ie=UTF8&t=m&ll=38.638864,-2.304554&spn=0.053634,0.085659&z=13&output=embed"
BA06,SANT PERE DE TORELLÓ,"Tal como entramos en Sant Pere de Torelló viniendo de Sant Vicenç de Torelló por la BV-5224, inciaremos el ascenso al pasar el puente sobre el Torrent del Pujol.",Iremos atentos por las calles empinadas de Sant Pere porque habremos de hacer dos giros a izquierdas siguiendo las indicaciones al Santuari de Bellmunt; el cementerio lo rozaremos por su muro izquierdo.,"Alcanzado el parking donde han de dejarse los coches, los ciclistas remataremos con 400 mts. durísimos de cemento para llegar al Santuario. Impresionante final.",Tramos de cemento.,42.10176,2.29375,"https://maps.google.es/maps/ms?msa=0&msid=201849215099252397790.0004f9aa69aa2bec209ed&hl=es&ie=UTF8&t=m&ll=42.085229,2.291508&spn=0.050959,0.085659&z=13&output=embed"
HL04,EL REPILADO,"En el km. 109 de la N-433 a la altura de El Repilado, tomando el desvío que indica hacia ""Centro Turístico"" y Posada de Cortegana.","Recorridos 2,7 kms de esta carretera, seguimos rectos, ignorando un nuevo desvío a la izquierda hacia Posada de Cortegana; al llegar a La Corte, giro a la derecha tomando la HU-8103 hacia Puerto Lucía.","Algo más de 1 km. después de dejar atrás La Corte, llegamos al punto más alto de la ascensión, con una pista que sale a la izquierda, y faltando otro km. para Puerto Lucía.",Asfalto malo (2013),37.95912,-6.81831,"https://maps.google.es/maps/ms?msa=0&msid=201849215099252397790.0004f8dffe87d74daad53&hl=es&ie=UTF8&t=m&ll=37.940407,-6.79985&spn=0.054152,0.085659&z=13&output=embed"
AS15,SAN ANDRÉS,"En la AS-228 entre Proaza y Trubia, encontraremos la aldea de San Andrés. Saliendo de este pueblo hacia Trubia, hallaremos el inicio en un desvío a la izquierda que lleva a Castañedo del Monte, justo al cruzar el río Trubia.","Al llegar a Castañedo, junto a la iglesia, debemos girar a la derecha en claro ascenso cruzando el pueblo; a los 7 kms. de ascenso, pasaremos por el centro de Linares y continuamos adelante.","Algo más de 1 km. después de Linares, en una zona llana, se acaba la subida, junto a un cartel local de madera, y cerca de unas antenas que coronan el monte más alto.",,43.27229,-6.02865,"https://maps.google.es/maps/ms?msa=0&msid=201849215099252397790.0004f7f7fc2247751c12c&hl=es&ie=UTF8&t=m&ll=43.292201,-6.000938&spn=0.049979,0.085659&z=13&output=embed"
AS36,RÍO NAVIA,"Salimos de San Antolín de Ibias hacia Sena, continuando hacia Barca y Valdeferreiros. Al cruzar el río Navia damos por iniciado el ascenso.",A los 700 mts. habremos pasado el cruce que a la izquierda nos llevaría a Parada; a los 2 kms. ignoramos la entrada a Murias por la izquierda; en el km. 4 dejamos esta vez a la derecha el desvío a Coea; pasado el km. 6 cruzamos Valdeferreiros y seguimos adelante.,"Algo más de 1 km. después del pueblo llegamos al punto más alto, junto a una caseta de ladrillo rojo que sirve de parada del autobús.",,43.02498,-6.98943,"https://maps.google.es/maps/ms?msa=0&msid=218028416192983371638.0004cac2c34fa8eee7a3a&ie=UTF8&t=m&ll=43.032196,-6.975889&spn=0.025096,0.04283&z=14&output=embed"
LU07,DOIRAS,"En la carretera LU-723, que comunica el valle del río Navia en Liber con las tierras leoneas de Balboa, por el puerto de O Portelo, nos situamos en un puente en la aldea de Doiras. Iniciamos aquí el ascenso siguiendo por la LU-723 hacia Balboa.","Seguiremos siempre por la LU-723 dejando a derecha e izquierda carreteras locales que va a pueblos como Vilarello o Vimiero, hasta el km. 8,5 en que coronamos el alto de O Portelo; aquí nos desviamos a la derecha para tomar una pista que conduce a Piedrafita de Cebreiro.","Algo más de 3 kms. después de ese desvío, llegamos al final sin ninguna señal que lo indique. Como referencia, es un cruce con una pista a la izquierda.",,42.72574,-6.98936,"https://maps.google.es/maps/ms?msa=0&msid=201849215099252397790.0004f78a1128f93aa7757&hl=es&ie=UTF8&t=m&ll=42.750794,-6.991081&spn=0.100843,0.171318&z=12&output=embed"
JA08,OTIÑAR / EMBALSE DE QUIEBRAJANO,"Salimos de Jaén por la JA-3210 hacia Puente de la Sierra, donde nos desviaremos hacia Otiñar. Poco después de dejar atrás la entrada a Otiñar, comenzaremos la ascensión en un cruce, tomando la indicación hacia Embalse de Quiebrajano.","En el km. 5,8 y tras pasar tres cortos túneles, alcanzamos la Presa de Quiebrajano, en la rotonda seguimos por la derecha; poco después, una barrera y volvemos a girar a la derecha.",Algo más de 5 kms. desde el inicio llegamos a un collado de paso con un letrero que nos anuncia un Monumento Natural,Asfalto malo (2013),37.61884,-3.76334,"https://maps.google.es/maps/ms?msa=0&msid=218028416192983371638.0004f7b229de30f4e7091&hl=es&ie=UTF8&t=m&ll=37.646044,-3.760414&spn=0.108737,0.171318&z=12&output=embed"
