SO04,SANTA INÉS,"Saliendo de Vinuesa hacia Montenegro de Cameros y el Puerto de Santa Inés por la SO-830, al poco de pasar el cruce a El Quintanarejo, veremos a la izquierda una indicación a la Laguna Negra. [ De seguir recto nos llevaría al SO09 Santa Inés por la vertiente de Vinuesa ] Unos 800 mts. después de dejar la SO-830 cruzamos el río Revinuesa y empieza la subida.","Actualmente tenemos dos carreteras hasta la Laguna, una de subida y otra de bajada, de direcciones únicas y obligatorias al menos en los períodos de mayor afluencia de visitantes a la Laguna. Para subir nos han dejado la menos bonita.","La subida acaba en la misma Laguna Negra. Para llegar a ella deberemos superar el parking de coches, y un último km. prohibido a vehículos a motor excepto el autobús tutístico. Una vez en el final de la pista asfaltada, nos quedarán 100 mts subiendo incluso unas escaleras bici en mano hasta la Laguna. Merece la pena.",,41.99863,-2.84332,"https://maps.google.es/maps/ms?msa=0&msid=201849215099252397790.0004f8a3760b519cd97e5&hl=es&ie=UTF8&t=m&ll=41.995605,-2.81559&spn=0.051031,0.085659&z=13&output=embed"
CE01,"N-354 (PK. 2,1)","La subida comienza en el punto kilométrico 2,1 de la N-354 frente a la playa Benítez, en la denominada carretera de Loma Larga.","En el km. 1,4 seguimos rectos dejando una carretera a la izquierda que baja a la ciudad de Ceuta.","La subida culmina en el mirador de Isabel II, desde donde se aprecian unas bonitas vistas de la ciudad, pudiéndose en los días de mayor claridad contemplar parte de la costa peninsular (Gibraltar, Algeciras, Tarifa).",,35.89286,-5.3641,"https://maps.google.es/maps/ms?msa=0&msid=201849215099252397790.0004f792aa966babb2231&hl=es&ie=UTF8&t=m&ll=35.891971,-5.353432&spn=0.055627,0.085659&z=13&output=embed"
SA09,LAS CASAS DEL CONDE,"Si venimos por la carretera que viene de San Miguel del Robledo a Mogarraz, pasadas Las Casas del Conde, empieza la subida al cruzar el río Francia hacia Mogarraz.","En el km. 1,4 seguimos por la derecha hacia Mogarraz; en el km. 4,8 seguimos por la derecha hacia La Alberca dejando a la izquierda la carretera que va a Monforte.",La subida finaliza en el cruce de la carretera que traemos con la que va hacia Sotoserrano a la izquierda.,,40.48972,-6.09212,"https://maps.google.es/maps/ms?msa=0&msid=201849215099252397790.0004f764bb1c534086864&hl=es&ie=UTF8&t=m&ll=40.494351,-6.071835&spn=0.052217,0.085659&z=13&output=embed"
SA09,LA REGAJERA,"Situándonos en Miranda del Castañar, en la carretera SA-225, a 2 kms. dirección Cepeda, giramos a la derecha, tomando la carretera DSA-260, dirección Mogarraz; 2 kms. más adelante, en el puente sobre el río Milano, comienza la subida.","En el km. 1,9 giramos a la izquierda, hacia Mogarraz; en el km. 5,2 seguimos por la derecha hacia La Alberca dejando a la izquierda la carretera que va a Monforte.",La subida finaliza en el cruce de la carretera que traemos con la que va hacia Sotoserrano a la izquierda.,,40.48972,-6.09212,"https://maps.google.es/maps/ms?msa=0&msid=201849215099252397790.0004f764b4e1c5d2f1a09&hl=es&ie=UTF8&t=m&ll=40.493307,-6.058273&spn=0.052218,0.085659&z=13&output=embed"
SC09,SAN SEBASTIÁN DE LA GOMERA,"En el puente sobre el Barranco de la Villa, en el centro de San Sebastián de la Gomera. Tenemos que dirigirnos hacia Valle de Gran Rey por la GM-2.","Ninguna, sólo hay que seguir la GM-2 ignorando los cruces que nos aparecen hasta lo más alto de la isla.","La subida llega, después de 23 kms., a una rotonda conocida como El Contadero, donde confluyen todas las vertientes, y donde podemos dar por finalizada la ascensión o, si queremos llegar al Mirador de Garajonay, tenemos dos opciones",,28.10942,-17.24836,"https://maps.google.es/maps/ms?msa=0&msid=218028416192983371638.0004ed44d1b221b6b96f3&ie=UTF8&t=m&ll=28.092881,-17.179871&spn=0.12115,0.171318&z=12&output=embed"
AT07,ADSUBIA,"Estando en Adsubia, debemos buscar la calle que conduce al ayuntamiento y de allí al barranco de Gallinera donde empezará la subida.","En poco más de 3 kms. nos cruzaremos con la carretera que viene de Pego, giraremos a la derecha; 2,5 kms. después, llegamos al desvío, a la derecha, que nos llevará hacia las antenas.",Las antenas que culminan en el Pico Chilibre.,,38.83035,-0.17735,"https://maps.google.es/maps/ms?msa=0&msid=201849215099252397790.0004f94ab562af3aafeca&hl=es&ie=UTF8&t=m&ll=38.837836,-0.162649&spn=0.026742,0.04283&z=14&output=embed"
AT07,PEGO,"En la localidad de Pego, saliendo por el Paseo del Calvario, pasando delante del cementerio.","Unos 500 mts. más adelante, giraremos a la izquierda siguiendo la indicación de Campo de Tiro. Cuando llevemos 6 kms. de ascensión, veremos el desvío a la derecha que nos llevará hasta las antenas.",Las antenas que culminan en el Pico Chilibre.,Asfalto muy malo (2013),38.83035,-0.17735,"https://maps.google.es/maps/ms?msa=0&msid=201849215099252397790.0004f94aba346f3785d7d&hl=es&ie=UTF8&t=m&ll=38.836097,-0.146942&spn=0.053486,0.085659&z=13&output=embed"
AT03,BENIARDÁ,"Si nos situamos en el pueblo de Beniardá, la ascensión comienza bajando hasta el puente sobre el río Beniardá, que se recoge en el cercano pantano de Guadalest. Iniciamos nuestros pasos volviendo hacia el pueblo de Beniardá.","A los 800 mts. pasamos el pueblo de Beniardá por la vía principal, haciendo varios giros por sus calles. Al salir del pueblo, en una bifurcación, podemos seguir por ambas opciones","las dos nos llevan a la CV-70, la de la izquierda haciendo 1,3 kms. más que la de la derecha. Al llegar a la CV-70 giramos a la derecha hacia Benifato. Más adelante, llegaremos al desvío a la izquierda hacia Benifato, y justo al entrar en sus primeras casas, veremos un desvío a la derecha por la calle Font de Partegat, indicado ""Port de Tudons 15 km."" . De aquí hasta arriba ya sólo nos quedará un cruce dudoso, tomando la de la derecha para no volver a Benifato.",,38.65785,-0.24182,"https://maps.google.es/maps/ms?msa=0&msid=201849215099252397790.0004f94ad919659d60632&hl=es&ie=UTF8&t=m&ll=38.674387,-0.230885&spn=0.053607,0.085659&z=13&output=embed"
HU02,BONO,"En el pueblo de Bono, en la N-230 que sube hacia el túnel de Viella. Aunque si no te gusta circular por una nacional y cruzar algunos túneles, el inicio se puede considerar también en el desvío de esta nacional N-230 hacia el pueblo de Aneto.","En el km. 15 de ascensión desde Bono (o km. 9 desde Aneto) hay un túnel con forma de ""Y"", hemos de girar a la izquierda.","Lo recomendable es llegar hasta la presa de Llauset, un paraje espectacular, pero para llegar a ella hay que cruzar un túnel de más de 1 km, bien iluminado pero de piso irregular. Tú decides, aunque no te arrepentirás si decides cruzar el túnel.",Asfalto muy malo poco aconsejable para ruedas finas (2017),42.58219,0.69691,"https://maps.google.es/maps/ms?msa=0&msid=218028416192983371638.00049b2992358bda381ef&hl=es&ie=UTF8&t=m&ll=42.562437,0.720634&spn=0.101148,0.171318&z=12&output=embed"
TA03,L'ESPLUGA DE FRANCOLÍ,"En L'Espluga de Francolí, en una rotonda donde se inicia la T-700 hacia Prades y Vilanova de Prades.","Seguiremos en todos los cruces las indicaciones a Prades. Sobre el km. 3,5 pasaremos ante el Monasterio de Poblet; sobre el km. 18 de ascensión se llega al cruce de Vilanova de Prades (Coll de les Masies), seguimos a la izquierda a Prades.","Más o menos en el km. 20 de la T-700, sin señalizar.",,41.33148,0.99327,"https://maps.google.es/maps/ms?msa=0&msid=201849215099252397790.0004f807e012c7a6a40ba&hl=es&ie=UTF8&t=m&ll=41.36573,1.048508&spn=0.103066,0.171318&z=12&output=embed"
TE05,TE-V-9024,"Poco antes de llegar al pueblo de Peracense, procedentes de Villar del Salz o Villafranca del Campo, ya se va ganando altura poco.",En el pueblo de Peracense seguir las indicaciones al Castillo.,"Nada más pasar ante las puertas del Castillo, hay queda un duro repecho donde termina la ascensión sin cartel alguno.",,40.63776,-1.48839,"https://maps.google.es/maps/ms?msa=0&msid=201849215099252397790.0004f791c71c8fa763883&hl=es&ie=UTF8&t=m&ll=40.639293,-1.480236&spn=0.026052,0.04283&z=14&output=embed"
MU04,LAS LIBRILLERAS,"En la RM-332 (antigua N-332) entre Mazarrón y Águilas, saliendo de Las Librilleras en dirección a Águilas. Poco después, llegaremos al cruce con la carretera que va al Cabo de Cope y podemos dar por iniciado el ascenso.","Pasados 10 kms. de ascensión, tenemos que girar a la derecha hacia Campico López.","No está muy claro ni hay indicación alguna, lo mejor es contar que llevamos recorridos 16,4 kms. de subida desde el cruce de Cabo Cope. NOTA",,37.55763,-1.56468,"https://maps.google.es/maps/ms?msa=0&msid=218028416192983371638.0004f7b88bb655617cc0b&hl=es&ie=UTF8&t=m&ll=37.536955,-1.525383&spn=0.108897,0.171318&z=12&output=embed"
ZA09,DAROCA,"A la salida de Daroca, al cruzar el río Jiloca en dirección a Santed y Molina de Aragón.","Unos 800 mts. más adelante, tomaremos el desvío a la derecha por la CV-632 a Balconchán (en el cartel está escrito Valconchán); en el km. 3,6 seguimos a la izquierda hacia Balconchán ignorando la derecha que se dirige a Orcajo.","No está señalizado, hay que fijarse cuándo la carretera comienza a descender, unos 9,4 kms desde de Daroca.",,41.0677,-1.47747,"https://maps.google.es/maps/ms?msa=0&msid=201849215099252397790.0004f9d16d701c68122e1&hl=es&ie=UTF8&t=m&ll=41.089055,-1.451569&spn=0.051752,0.085659&z=13&output=embed"
ZA07,MORATA DE JILOCA,"En Morata de Jiloca, al cruzar el puente sobre el río Jiloca en dirección a Acered por la A-2507.","En el km. 9,5 seguimos hacia Cubel a la izquierda, ignorando la derecha que se dirige a Castejón de Alarba; en el km. 11,2 seguimos recto hacia Cubel.","No está señalizado, y ofrece muchas dudas porque los últimos kms. son muy irregulares. Debe encontrarse sobre el km. 20,6 desde Morata de Jiloca.",,41.11292,-1.60193,"https://maps.google.es/maps/ms?msa=0&msid=201849215099252397790.0004f9d15f3acd6ec6951&hl=es&ie=UTF8&t=m&ll=41.17762,-1.600571&spn=0.206728,0.342636&z=11&output=embed"
PO06,CERDEDO,"En la N-451 al paso por Cerdedo, tomamos el desvío hacia Pesqueiras y Santo Domingo por la PO-7104. Descenderemos hasta el río de Castro y al cruzar el puente sobre él iniciamos el ascenso.","Seguiremos en todo momento las indicaciones hacia el Parque Eólico Monte Seixo; en el km. 3,9 giramos a la derecha hacia Carballás; al dejar atrás el pueblo, seguimos la pista asfaltada que va subiendo hacia los aerogeneradores.","No hay cartel indicando el final, el punto más alto se encuentra justo al lado del aerogenerador OC-9. En la carretera hay una raya y la palabra 'META'.",,42.49346,-8.36444,"https://maps.google.es/maps/ms?msa=0&msid=201849215099252397790.0004f816fcc3da7c4a152&hl=es&ie=UTF8&t=m&ll=42.513234,-8.365574&spn=0.050614,0.085659&z=13&output=embed"
CA18,LA PEDROSA,"Subiendo desde Liérganes a San Roque de Riomiera por la CA-260 y 800 mts. antes de llegar a éste último, hallaremos un desvío a la izquierda que nos indica al camping Lunada, Calseca y Valdicio; bajamos unos 300 mts. y al cruzar un sencillo puente, iniciamos el ascenso.","En el km. 1,0, giramos a la izquierda, dejando a la derecha la que lleva a Calseca; en el km. 2,4 seguimos rectos, cruzando un paso canadiense, hacia El Monumento a la Vaca Pasiega y Bustablado.","No hay cartel ni indicación alguna, debemos contar que llevamos 5,20 kms. desde el punto inicial. Si seguimos hacia Bustablado, sortearemos una serie de repechos y pasaremos ante el Monumento a la Vaca Pasiega antes de descender definitivamente hacia Bustablado por la otra vertiente.",,43.25489,-3.6665,"https://maps.google.es/maps/ms?msa=0&msid=201849215099252397790.0004f8d5d9ed98734e582&hl=es&ie=UTF8&t=m&ll=43.246328,-3.679562&spn=0.050016,0.085659&z=13&output=embed"
CA18,BUSTABLADO,Entramos en Bustablado llegando de Arredondo.,"Al llegar a Bustablado continuamos con la misma dirección al pasar junto a la iglesia; a los 800 mts. de dejar Bustablado, se coge un desvío a la izqueirda que baja al puente de un arroyo y seguimos dirección San Roque de Riomiera.","No hay cartel ni indicación alguna, debemos contar que llevamos unos 9 kms. desde el punto inicial, el final es algo irregular. Poco antes, habremos pasado por delante del Monumento a la Vaca Pasiega.",Tramos de cemento.,43.25489,-3.6665,"https://maps.google.es/maps/ms?msa=0&msid=201849215099252397790.0004f8d5d4035e11a0df1&hl=es&ie=UTF8&t=m&ll=43.266456,-3.654842&spn=0.05,0.085659&z=13&output=embed"
CU10,PUENTE DE VADILLOS,"Vertiente larga y muy escénica de este CIMA. Se inicia en Puente de Vadillos, junto al río Guadiela, saliendo en dirección a Beteta por la CM-210 para cruzar en sus primeros kms. el Monumento Natural de la Hoz de Beteta.","Al llegar a Beteta, tenemos la opción más tranquila de seguir dirección Masegosa y Tragacete, o meternos por las calles de Beteta superando varias curvas de herradura; ambas opciones vuelven a unirse pasado Beteta, siempre siguendo las indicaciones a Masegosa; en Masegosa no hay que entrar, seguimos hacia Tragacete y Peralejos; algo más de 6 kms. después de Masegosa, giramos a la izquierda, desechando la que a la derecha nos llevaría a Tragacete por el Collado Serracín.","No hay cartel ni indicación alguna. Desde este último cruce, 2,2 kms. después se llega al punto más alto.",,40.55837,-1.9542,"https://maps.google.es/maps/ms?msa=0&msid=201849215099252397790.0004f8e9ab306e293b6f0&hl=es&ie=UTF8&t=m&ll=40.558678,-2.04483&spn=0.208669,0.342636&z=11&output=embed"
BA14,CENTRAL TÉRMICA DE CERCS,"En la C-16 que sube de Berga a Guardiola de Berguedá, iniciamos el ascenso al desviarnos, pasado Cercs, a la izquierda tomando la BV-4025 a Figols.","En el km. 5,6 dejamos el desvío a la izquierda a Figols para seguir recto a Fumanya y Peguera; en el km. 10,7 seguimos rectos, ignorando la derecha que lleva a Vallcebre.","No hay cartel ni indicación alguna. Es una curva muy cerrada, con un notable cambio de rasante y una gran roca en el lado izquierdo. NOTA",,42.16625,1.76725,"https://maps.google.es/maps/ms?msa=0&msid=201849215099252397790.0004f9ab590129c3df2e5&hl=es&ie=UTF8&t=m&ll=42.177398,1.813431&spn=0.10177,0.171318&z=12&output=embed"
CC12,HERVÁS,"Salimos de Hervás por el barrio Judío, por la carretera que nos lleva a La Garganta, también nos indica hacie ""Picadero"".","En el km. 11,6 llegamos a la carretera que por la izquierda viene de La Garganta, y debemos seguir a la derecha hacia Candelario.","No hay cartel, es un collado de paso. Una cabaña a la derecha y la vista del embalse de Angosturas a lo lejos en la vertiente contraria pueden indicarnos el final.",,40.33151,-5.79491,"https://maps.google.es/maps/ms?msa=0&msid=218028416192983371638.0004ba1fd42af1b6f5dd9&ie=UTF8&t=m&ll=40.306498,-5.834427&spn=0.104726,0.172005&z=12&output=embed"
CC12,BAÑOS DE MONTEMAYOR,"En Baños de Montemayor, en la N-630, junto al Hotel Balneario, salimos en dirección Salamanca. 600 mts. después, hallaremos el desvío a la derecha hacia La Garganta por la CC-V-16.","En el km. 8,1 seguimos hacia la izquierda a Candelario, dejando a la derecha la carretera que va a Hervás.","No hay cartel, es un collado de paso. Una cabaña a la derecha y la vista del embalse de Angosturas a lo lejos en la vertiente contraria pueden indicarnos el final.",,40.33151,-5.79491,"https://maps.google.es/maps/ms?msa=0&msid=201849215099252397790.0004f7c584d7c69d71c79&hl=es&ie=UTF8&t=m&ll=40.318933,-5.82653&spn=0.052354,0.085659&z=13&output=embed"
CC01,VILLAR DE PLASENCIA,Dejamos la autovía A-66 en la salida hacia Villar de Plasencia por la CC-94. Justo en la rotonda de salida de la autovía iniciamos el ascenso.,Llegando a Cabezabellosa seguiremos la carretera que continua a El Torno.,"No hay cartel, estaremos atentos a llevar 10,5 kms. desde el inicio.",,40.12538,-6.00037,"https://maps.google.es/maps/ms?msa=0&msid=201849215099252397790.0004f7bd8f96b5f7a12f1&hl=es&ie=UTF8&t=m&ll=40.137809,-6.018963&spn=0.052494,0.085659&z=13&output=embed"
CC01,VALLE DEL JERTE,"En la N-110 entre Navaconcejo y Plasencia, tomamos la carretera que se dirige a El Torno y Cabezabellosa; 100 mts. más adelante cruzamos el río Jerte dando inicio a la ascensión.","En el km. 5,4 se llega a El Torno y giramos a la izquierda hacia Cabezabellosa.","No hay cartel, estaremos atentos a llevar 5,5 kms. desde el giro a izquierdas en Cabezabellosa.",,40.12538,-6.00037,"https://maps.google.es/maps/ms?msa=0&msid=201849215099252397790.0004f7bd95bc0672ab4c8&hl=es&ie=UTF8&t=m&ll=40.122716,-5.972099&spn=0.052505,0.085659&z=13&output=embed"
CR02,PRESA DE MONTORO,Carretera CR-500 entre las localidades de Mestanza y Solana del Pino; iniciamos la subida a la altura de la presa de Montoro.,"En el km. 10,5 seguimos por la derecha por la CP-500 a Solana del Pino.","No hay cartel, la subida termina en una curva muy cerrada.",Asfalto malo (2013),38.47983,-4.09726,"https://maps.google.es/maps/ms?msa=0&msid=201849215099252397790.0004f77b5775e82528c37&hl=es&ie=UTF8&t=m&ll=38.496594,-4.102364&spn=0.10748,0.171318&z=12&output=embed"
SA04,PRESA,"En el Poblado de Iberdrola, cerca de la Presa de Aldeadávila.","Después de 1 km., giramos a la derecha, dejando a la izquierda la carretera que va a la Presa y a su mirador; en el km. 5,4 giramos a la izquierda hacia Aldeadávila, ignorando la que sigue recto y que lleva a Vitigudino.","No hay cartel, podemos dar por finalizada la subida al llegar a un cruce que a la izquierda lleva a ""Parque 400 KV"", quedando casi 2 kms. para llegar a Aldeadávila. NOTA",,41.20688,-6.63916,"https://maps.google.es/maps/ms?msa=0&msid=201849215099252397790.0004f764ec563a5f2643c&hl=es&ie=UTF8&t=m&ll=41.193898,-6.66853&spn=0.051669,0.085659&z=13&output=embed"
CC02,PASARÓN,En la EX-213 entre Jaraiz de la Vera y Arroyomolinos de la Vera encontraremos el inicio de la subida en una rotonda donde desvía hacia Pasarón de la Vera.,"En el km. 3,1 giramos a la izquierda hacia Piornal; en el km. 14,6 a la entrada de Piornal, giramos a la derecha hacia Garganta la Olla.","No hay cartel, una larga recta plana nos indicará que hemos terminado el ascenso.",,40.1246,-5.81651,"https://maps.google.es/maps/ms?msa=0&msid=201849215099252397790.0004f7c51c5dd85a0e2a5&hl=es&ie=UTF8&t=m&ll=40.083851,-5.831337&spn=0.105071,0.171318&z=12&output=embed"
CC02,CABRERO,"En la N-110 entre Plasencia y Navaconcejo, en el desvío hacia Casas del Castañar y Cabrero.","En los pueblos que se pasan, seguir las indicaciones hacia Piornal, y en Piornal, desvío a la izquierda hacia Garganta la Olla.","No hay cartel, una larga recta plana nos indicará que hemos terminado el ascenso.",,40.1246,-5.81651,"https://maps.google.es/maps/ms?msa=0&msid=201849215099252397790.0004f7c515cd0994dc542&hl=es&ie=UTF8&t=m&ll=40.109588,-5.884895&spn=0.105031,0.171318&z=12&output=embed"
CC02,VALDASTILLAS,"En la N-110 entre Plasencia y Navaconcejo, en el desvío hacia Valdastillas y Piornal.","Siempre siguiendo las indicaciones hacia Piornal, y en Piornal, desvío a la izquierda hacia Garganta la Olla.","No hay cartel, una larga recta plana nos indicará que hemos terminado el ascenso.",,40.1246,-5.81651,"https://maps.google.es/maps/ms?msa=0&msid=201849215099252397790.0004f7c50f0ed2f2fcb6c&hl=es&ie=UTF8&t=m&ll=40.12626,-5.85331&spn=0.052503,0.085659&z=13&output=embed"
MU04,MORATA,Salimos de Morata en dirección a Lorca por la D-4.,"A los 7,8 kms. nos desviamos a la izquierda hacia Campico López.","No hay cartel. Desde Morata son casi 10 kms., y arriba encontraremos una especie de algibe con una caseta y dos bancos para sentarse a mirar el lejano Lorca al fondo del valle. Si seguimos, Campico López dista 700 mts.",,37.55763,-1.56468,"https://maps.google.es/maps/ms?msa=0&msid=218028416192983371638.0004f7b8970a55216cf46&ie=UTF8&t=m&ll=37.57914,-1.525383&spn=0.108835,0.171318&z=12&output=embed"
BA17,"C-16, DIRECCIÓN MALANYEU","En la C-16 entre Cercs y Guardiola de Berguedá, iniciamos el ascenso en el desvío a Malanyeu.","En el km. 3,2 hacemos un giro a la derecha hacia La Nou.","No hay ningún cartel en el alto, ante la duda, observad que llevamos casi 5 kms. de subida desde la C-16.",,42.18086,1.88692,"https://maps.google.es/maps/ms?msa=0&msid=201849215099252397790.0004f9ab7392dce72b6e9&hl=es&ie=UTF8&t=m&ll=42.188847,1.878319&spn=0.025438,0.04283&z=14&output=embed"
AM04,VÍCAR,"En la N-340a entre Almería y El Ejido, al paso por La Puebla de Vícar, buscamos la carretera que se dirige a Villa de Vícar.","A los 2 kms. pasamos sobre la autovía A-7 y continuamos hacia Vícar; en el km. 3,5 dejamos a la izquierda Vícar para seguir a la derecha hacia Felix; en el km. 9,3 se alcanza el Collado del Retamar, ignoramos el desvío a la derecha a Motril y a la izquierda hacia Felix y seguimos por la A-391 hacia Enix y Canjáyar; en los sucesivos cruces que encontraremos seguiremos las indicaciones a Canjáyar y el Parque Eólico.","No hay ninguna indicación pero es un claro collado de paso, a la izquierda sale una pista que enfila hacia los aerogeneradores nada más pasar un edificio viejo y abandonado.",,36.89813,-2.61186,"https://maps.google.es/maps/ms?msa=0&msid=218028416192983371638.0004e7b08207ba55ae3bd&ie=UTF8&t=m&ll=36.852703,-2.604103&spn=0.109888,0.171318&z=12&output=embed"
AM04,EL PARADOR DE LAS HORTICHUELAS,"En la N-340a entre Almería y El Ejido, al paso por El Parador de las Hortichuelas, iniciamos el ascenso en una rotonda tomando dirección Autovía A-7.","A los primeros 1,7 kms. encontraremos tres rotondas, hemos de seguir en dirección a La Envía, Enix y Felix por la A-391; en el km. 8,0 se alcanza el Collado del Retamar, ignoramos los desvíos a la izquierda hacia Vicar y Felix y seguimos por la A-391 hacia Enix y Canjáyar; en los sucesivos cruces que encontraremos seguiremos las indicaciones a Canjáyar y el Parque Eólico.","No hay ninguna indicación pero es un claro collado de paso, a la izquierda sale una pista que enfila hacia los aerogeneradores nada más pasar un edificio viejo y abandonado.",,36.89813,-2.61186,"https://maps.google.es/maps/ms?msa=0&msid=201849215099252397790.0004f77abfafadc52df13&hl=es&ie=UTF8&t=m&ll=36.853527,-2.60891&spn=0.109887,0.171318&z=12&output=embed"
AM01,OHANES,"En la A-348 entre Rágol y Canjáyar, hallaremos el desvío hacia Ohanes y Abla por la AL-3404.","En el km. 8,2 justo al llegar a Ohanes, giramos a la derecha hacia Abla y Tices.","No hay ninguna indicación y es muy irregular, habrá que contar que llevamos algo más de 18 kms. desde el desvío inicial.",,37.09048,-2.75463,"https://maps.google.es/maps/ms?msa=0&msid=201849215099252397790.0004f77ad9360d8cdee7c&hl=es&ie=UTF8&t=m&ll=37.046135,-2.741089&spn=0.109609,0.171318&z=12&output=embed"
AM07,GUAINOS BAJOS KM.382,"Si transitamos por la N-340 desde Adra hacia Motril y Málaga, justo al pasar Guaínos Bajos, sobre el km. 382,7 tomaremos el desvío a la derecha sin señalizar.",A los 500 mts. pasaremos sobre la A-7 y seguiremos siempre en dirección a Los Pérez.,"No hay ninguna indicación, habremos de calcular que llevamos 4,4 kms. desde que abandonamos la N-340. NOTA",,36.77351,-3.08026,"https://maps.google.es/maps/ms?msa=0&msid=201849215099252397790.0004f77a97a570aeacc15&hl=es&ie=UTF8&t=m&ll=36.758966,-3.076859&spn=0.055011,0.085659&z=13&output=embed"
AM07,GUAINOS BAJOS KM 386,"Si transitamos por la N-340 desde Adra hacia Motril y Málaga, al poco de dejar atrás Adra y junto al poste del km. 386 tomaremos el desvío a la derecha que nos indica a La Parra por la AL-6301.",A los 750 mts. pasaremos bajo la A-7 y seguiremos siempre en dirección a La Parra.,"No hay ninguna indicación, unos 500 mts. después de pasar La Parra, siempre en la AL-6301. NOTA",,36.77351,-3.08026,"https://maps.google.es/maps/ms?msa=0&msid=201849215099252397790.0004f77a9daa2a86158a2&hl=es&ie=UTF8&t=m&ll=36.762817,-3.052139&spn=0.055009,0.085659&z=13&output=embed"
GR11,CANILES,"Circulando por la A-334 desde Baza hacia Serón, al paso por el pueblo de Caniles, podemos dar por iniciado el ascenso al cruzar el río Guadalopón y poco antes del desvío hacia Escúllar y Abla.","A los 700 mts. dejaremos la A-334 para tomar la GR-8101 que a la derecha se dirige hacia Escúllar, carretera que ya no dejaremos en toda la ascensión. Un km. antes de coronar habremos entrado en provincia de Almería y la numeración será la AL-5405.","No hay ninguna indicación. Es un suave collado con curva ligera hacia la derecha y donde la carretera sale en un pinar. (*) Puerto fronterizo entre dos provincias, por lo que subirlo por cada vertiente puntúa para cada provincia, en este caso para Almería y Granada. Ver AM02.",Asfalto muy malo (2014),37.25332,-2.77476,"https://maps.google.es/maps/ms?msa=0&msid=218028416192983371638.0004f7560206d0c6b2d73&hl=es&ie=UTF8&t=m&ll=37.334132,-2.769928&spn=0.436768,0.685272&z=10&output=embed"
AM02,ABLA,"Partimos de la localidad de Abla, saliendo por la ALP-5405 hacia Estación de Abla y Escúllar. A los 500 mts. pasamos el puente sobre el río Nacimiento, dando inicio a la ascensión.","En el km. 2,2 giramos a la izquierda hacia Escúllar; en el km. 8,0 dejamos el acceso a Escúllar a la derecha para seguir por la izquierda hacia Caniles, en todo momento por la AL-5405..","No hay ninguna indicación. Es un suave collado con curva ligera hacia la izquierda y donde la carretera se adentra en un pinar. (*) Puerto fronterizo entre dos provincias, por lo que subirlo por cada vertiente puntúa para cada provincia, en este caso para Almería y Granada. Ver GR11.",Asfalto muy malo (2014),37.25332,-2.77476,"https://maps.google.es/maps/ms?msa=0&msid=201849215099252397790.0004f77ad2e133a3b4b70&hl=es&ie=UTF8&t=m&ll=37.203535,-2.774048&spn=0.218763,0.342636&z=11&output=embed"
