GR10,LA CALAHORRA,"En la A-337 que comunica Guádix con la provincia de Almería por el puerto de La Ragua, al paso por La Calahorra iniciamos la ascensión, en un desvío que nos indica Ferreira y Puerto de la Ragua.","Permanecemos en todo momento en la A-337 ignorando un desvío en el km. 1,5 que a la izqueirda se dirige a Ferreira.","Tiene cartel de puerto, junto al punto de información de las pistas de esquí.",,37.11355,-3.02996,"https://maps.google.es/maps/ms?msa=0&msid=218028416192983371638.0004fa9c73345d8c5d6a2&ie=UTF8&t=m&ll=37.147729,-3.049049&spn=0.109462,0.171318&z=12&output=embed"
GR10,CHERÍN,"En la A-348 entre Ugíjar y Alcolea nos desviamos por la A-337 hacia Cherín y el Puerto de la Ragua. Damos inicio al puerto en Cherín, al desviarnos hacia Laroles.",Sin dejar en ningún momento la A-337 cruzamos Picena y Laroles.,"Tiene cartel de puerto, junto al punto de información de las pistas de esquí.",,37.11355,-3.02996,"https://maps.google.es/maps/ms?msa=0&msid=218028416192983371638.0004f7560c0b6898a2538&hl=es&ie=UTF8&t=m&ll=37.034899,-3.02124&spn=0.219251,0.342636&z=11&output=embed"
PR08,SAO VICENTE,"En Sao Vicente, tomando la ER104 que se dirige a Ribeira Brava.","En el km. 4,7 giramos a la izquierda, hacia Ribeira Brava y Vía Encumeada.","Tiene cartel de puerto, justo en el cruce con la carretera que a la izquierda baja a Ribeira Brava y Funchal. NOTA",,32.75434,-17.01882,"https://maps.google.es/maps/ms?msa=0&msid=201849215099252397790.0004f78b52926f933c7b9&hl=es&ie=UTF8&t=m&ll=32.774863,-17.030869&spn=0.115467,0.171318&z=12&output=embed"
AL02,ELORTZA,Salimos de Elortza/Leorza por la A-3114 dirección Salvatierra/Agurain e Iturrieta.,"En el km. 4,9 llegamos a un cruce que a la derecha va a Sabando, tenemos que seguir recto hacia Salvatierra; en el km. 9,6 alcanzamos el cruce que a la derecha va a Santa Teodosia, tenemos que seguir recto.","Tiene cartel de puerto, justo en el cruce con la carretera que viene de San Vicente de Arana.",,42.79303,-2.33287,"https://maps.google.es/maps/ms?msa=0&msid=201849215099252397790.0004f7bb00d5bc02acec1&hl=es&ie=UTF8&t=m&ll=42.766423,-2.397423&spn=0.100817,0.171318&z=12&output=embed"
LL12,PONTS,"A la salida de Ponts por la C-14 hacia La Seu d'Urgell, tomando la carretera C-1412b que nos lleva a Isona y Tremp. La ascensión comienza poco después de este desvío, al cruzar el río Segre.","En el km. 11,5 seguimos rectos ignorando una derecha que se dirige a La Torre de Rialb y Politg; en el km. 20,6 seguimos a la derecha hacia Isona y Tremp.","Tiene cartel de puerto, justo en un cruce de carreteras y cambio de comarca.",,42.05482,1.08983,"https://maps.google.es/maps/ms?msa=0&msid=201849215099252397790.0004f9b23f9795259fbc0&hl=es&ie=UTF8&t=m&ll=41.984505,1.170044&spn=0.20416,0.342636&z=11&output=embed"
AV05,TREMEDAL,"En la N-110 entre El Barco de Ávila y Puerto Castilla, empezamos la ascensión a la altura del pueblo de La Carrera al dejar esta nacional tomando dirección Cereceda y El Tremedal. Es la AV-P-675.","Cruzaremos varios pueblos, buscando las indicaciones a Tremedal o Becedas.","Tiene cartel de puerto, justo en un paso canadiense.",,40.3647,-5.6175,"https://maps.google.es/maps/ms?msa=0&msid=201849215099252397790.0004f8a61128f1a1e8a43&hl=es&ie=UTF8&t=m&ll=40.347852,-5.587234&spn=0.052331,0.085659&z=13&output=embed"
AS26,SONANDE,"Abandonamos la AS-213 que desde Cangas del Narcea se dirige a Leitariegos a la altura de Las Mestas, para ir por la CN-4 hacia Carballo y Cibea. Poco después de este último está Sonande, punto de inicio de esta ascensión.",A los 4 kms. alcanzamos la AS-213 y seguimos por la izquierda ascendiendo hacia Leitariegos.,"Tiene cartel de puerto, llegando a El Puerto de Leitariegos, y poco después se entra en León.",,42.9995,-6.41997,"https://maps.google.es/maps/ms?msa=0&msid=201849215099252397790.0004f7f6f323285bf5842&hl=es&ie=UTF8&t=m&ll=43.029749,-6.440392&spn=0.100388,0.171318&z=12&output=embed"
AV09,MOMBELTRÁN,"En la N-502 entre Ramacastañas y Mombeltrán, podemos considerar el inicio en el cruce de esta carretera con la que va a Santa Cruz del Valle, dirigiéndonos hacia Mombeltrán y Ávila. [ Mismo inicio que el AV04 Serranillos por Santa Cruz del Valle y Mombeltrán ].",Circularemos en todo momento por la N-502 ignorando los cruces que nos vayan saliendo a derecha e izquierda.,"Tiene cartel de puerto, magnífico mirador y mejor fuente.",,40.3216,-5.01314,"https://maps.google.es/maps/ms?msa=0&msid=201849215099252397790.0004f8a539ec2155dae70&hl=es&ie=UTF8&t=m&ll=40.282669,-5.013885&spn=0.104763,0.171318&z=12&output=embed"
AB08,CM-412,"Salimos de Riópar hacia Alcaraz por la CM-412, y empieza la subida en el cruce con la C-415 que se dirige a Riópar Viejo y Vianos.","A 600 mts. seguiremos recto, dejando a la derecha la carretera que va a Riópar Viejo.","Tiene cartel de puerto, no hay pérdida.",Asfalto malo (2013),38.52764,-2.42482,"https://maps.google.es/maps/ms?msa=0&msid=201849215099252397790.0004f8fa47c2781fb246b&hl=es&ie=UTF8&t=m&ll=38.515534,-2.444458&spn=0.053726,0.085659&z=13&output=embed"
AB02,VIANOS,Salimos de Alcaraz por la CM-3216 que se dirige a Vianos y El Barrancazo. Empieza la subida al cruzar un puente sobre un pequeño ríachuelo.,"A los 6 kms. cruzaremos el pueblo de Vianos; poco después, seguiremos recto dejando a la derecha una carretera que va a Zapateros. En el km. 11 alcanzamos el Collado Tuertecillo y vienen más de 2 kms. de descenso hasta cruzar un río, desde el que quedan aún 5 kms. de puerto.","Tiene cartel de puerto, no hay pérdida.",,38.57661,-2.41852,"https://maps.google.es/maps/ms?msa=0&msid=201849215099252397790.0004f8f9a83c9e23a34b8&hl=es&ie=UTF8&t=m&ll=38.61687,-2.467117&spn=0.1073,0.171318&z=12&output=embed"
GI08,VALL DE BIANYA,"Salimos de Olot por la N-260 (C-26) hacia Sant Joan de les Abadeses por la Vall de Bianya; pasado L'Hostalnou de Bianya continuamos hacia Sant Joan de les Abadeses y llegando al km. 91 de la citada N-260 daremos inicio a la ascensión, al cruzar la Riera de Farró junto al desvío a derecha que nos indica Capsec.","En el km. 3,8 hemos de tomar a la derecha hacia Sant Salvador de Bianya por la C-153a.","Tiene cartel de puerto, no hay pérdida.",,42.25659,2.39785,https://www.google.com/maps/d/embed?mid=zjPGjqFDFxZw.kpXIE_ayvJwU
GI06,OLOT,Es la N-260a que comunica Olot con Ripoll por Vallfogona del Ripollés. Iniciamos la ascensión al cruzar el río Ridaura y pasar por el Hostal del Sol.,"En el km. 9,7 ignoramos un desvío que a la derecha lleva a Sant Joan de les Abadeses, debemos seguir la carretera principal hacia Vallfogona y Ripoll.","Tiene cartel de puerto, no hay pérdida.",,42.19718,2.34596,"https://maps.google.es/maps/ms?msa=0&msid=201849215099252397790.0004f9aff4541fa508a69&hl=es&ie=UTF8&t=m&ll=42.18732,2.419395&spn=0.101754,0.171318&z=12&output=embed"
AB09,VILLAVERDE DE GUADALIMAR,"Salimos de Villaverde de Guadalimar hacia Riópar y Siles por la CM-3205, y al pasar un pequeño puente, damos inicio a la subida.","En sólo 400 mts. llegaremos a la carretera CM-3204 Riópar-Siles, donde giraremos a la izquierda, dirección Riópar.","Tiene cartel de puerto, no hay pérdida. 800 mts. después, está el desvío al Nacimiento del río Mundo, muy recomendable su visita.",,38.46821,-2.45576,"https://maps.google.es/maps/ms?msa=0&msid=201849215099252397790.0004f8fa5029185cc5058&hl=es&ie=UTF8&t=m&ll=38.456277,-2.489777&spn=0.05377,0.085659&z=13&output=embed"
CS11,LUDIENTE,"Saliendo de Argelita hacia Ludiente, por la CV-190, al dejar a la derecha la carretera que va a Mas del Moro y Lucena. [ Mismo inicio que el CS17 Mas del Moro ]","Cuando nos aproximemos a Castillo de Villamalefa, habrá que girar a la derecha sentido Llucena.","Tiene cartel de puerto, por lo que no tiene pérdida.",,40.14143,-0.35049,"https://maps.google.es/maps/ms?msa=0&msid=201849215099252397790.0004f96c9c3de94e1104a&hl=es&ie=UTF8&t=m&ll=40.099872,-0.356026&spn=0.105046,0.171318&z=12&output=embed"
CS11,CASTILLO DE VILLAMALEFA,"En la CV-190 entre Zucaina y Villamalefa, al cruzar un barranco.","Una vez pasado Castillo de Villamalefa, girar a la izquierda a Llucena.","Tiene cartel de puerto, por lo que no tiene pérdida.",,40.14143,-0.35049,"https://maps.google.es/maps/ms?msa=0&msid=201849215099252397790.0004f96c95edf17ae0dfc&hl=es&ie=UTF8&t=m&ll=40.132035,-0.38126&spn=0.052498,0.085659&z=13&output=embed"
LL06,PONT DE SUERT,"En la N-260 que va de Pont de Suert a La Pobla de Segur, damos inicio a la subida a la salida de Pont de Suert.","Antes de llegar a la Creu de Perves, se corona otro alto con cartel, Viu de Llevata, junto al pueblo del mismo nombre.","Tiene cartel de puerto, un collado claro de paso.",,42.35772,0.84204,"https://maps.google.es/maps/ms?msa=0&msid=201849215099252397790.0004f9b280f4687795eca&hl=es&ie=UTF8&t=m&ll=42.374017,0.792732&spn=0.101453,0.171318&z=12&output=embed"
GI05,VALL D'EN BAS,"En la C-152 entre Olot y St. Esteve d'en Bas, tomaremos la GIV-5273 dirección Joanetes. La ascensión comienza cuando nos crucemos con la carretera interior que comunica Els Hostalets y El Mallol.",El pueblo de Joanetes lo podemos atravesar por su calle principal o podemos rodearlo por la izquierda siguiente las indicaciones a Torelló.,"Tiene cartel de puerto, un collado claro de paso. (*) Puerto fronterizo entre dos provincias, por lo que subirlo por cada vertiente puntúa para cada provincia, en este caso para Girona y Barcelona. Ver BA03.",,42.10848,2.37661,"https://maps.google.es/maps/ms?msa=0&msid=201849215099252397790.0004f9b00414c0c3fdfc8&hl=es&ie=UTF8&t=m&ll=42.116052,2.415104&spn=0.050935,0.085659&z=13&output=embed"
BA16,GUARDIOLA DE BERGUEDÁ,"Salimos de Guardiola de Berguedá por la C-16 hacia Berga y enseguida veremos el desvío a la derecha hacia Vallcebre, Saldes y Gosol por la B-400.","En el km. 6,8 giro a la izquierda hacia Vallcebre; en el km. 12 seguimos la indicación de Coll de Pradell ignorando la izquierda que va a Fumanya y Figols.","Tiene cartel de puerto, una de las obras maestras de BuruM.",Tramos de cemento.,42.20114,1.76982,"https://maps.google.es/maps/ms?msa=0&msid=201849215099252397790.0004f9ab68b96a91f9580&hl=es&ie=UTF8&t=m&ll=42.208431,1.816521&spn=0.10172,0.171318&z=12&output=embed"
GU08,UMBRALEJO / LA HUERCE,"Entre Valverde de los Arroyos y Umbralejo, por la GU-211, al cruzar el puente del río Sorbe.","Cuando llevemos 4,4 kms desde el puente sobre el río Sorbe, llegaremos a un cruce con la CM-1006, debemos tomar a la izquierda dirección Galve; en el camino hacia la cima encontraremos dos cruces a sendos pueblos a la izquierda, hemos de seguir siempre recto dirección Galve de Sorbe.","Tiene cartel de puerto, unos 3 kms. después de pasar el cruce a Valdepinillos.",,41.18568,-3.18737,"https://maps.google.es/maps/ms?msa=0&msid=201849215099252397790.0004f778e79e49095a13a&hl=es&ie=UTF8&t=m&ll=41.151516,-3.182602&spn=0.103405,0.171318&z=12&output=embed"
AL05,LEZA,"En la A-124, carretera que comunica Laguardia con Samaniego, encontraremos el desvío a la derecha hacia Peñacerrada (a la izquierda se dirige a Leza).","Cuando nos queda 1 km para el alto, a la izquierda nos aparece una pista que se acerca al Balcón de La Rioja, un mirador que bien merece una pausa o una visita al voler.","Tiene cartel de puerto, y un monumento a los vinos de la Rioja Alavesa.",,42.59638,-2.68247,"https://maps.google.es/maps/ms?msa=0&msid=201849215099252397790.0004f7bade9aecf1ab8c8&hl=es&ie=UTF8&t=m&ll=42.582411,-2.663841&spn=0.050558,0.085659&z=13&output=embed"
BA09,NAVARCLES,"En la N-141 entre Sant Fruitós y Calders, veremos el desvío a Navarcles. Empieza la subida al pasar el puente sobre el río Llobregat, y cruzaremos Navarcles buscando la dirección a Talamanca y Terrassa.","A los 14,7 kms. ignoraremos un cruce que a la derecha conduce a Mura, nuestro camino va siempre hacia Terrassa.",Tiene cartel de puerto.,,41.6704,1.99479,"https://maps.google.es/maps/ms?msa=0&msid=201849215099252397790.0004f9aa92d8ba37f0244&hl=es&ie=UTF8&t=m&ll=41.712136,1.94046&spn=0.102516,0.171318&z=12&output=embed"
IB09,SA CALOBRA,"En la misma orilla del mar, en el Port de Sa Calobra, saliendo por la única carretera que hay, la Ma-2141. Claro, para llegar a este punto, previamente habremos bajado todo el puerto.",A los 2 kms. seguimos recto ignorando un desvío a la derecha que se dirige a la Cala Tuent.,Tiene cartel de puerto.,,39.82755,2.81776,"https://maps.google.es/maps/ms?msa=0&msid=201849215099252397790.0004f74036f7d3ee75ad4&hl=es&ie=UTF8&t=m&ll=39.838859,2.801514&spn=0.052724,0.085659&z=13&output=embed"
AV04,MOMBELTRÁN,"En la N-502 entre Ramacastañas y Mombeltrán, podemos considerar el inicio en el cruce de esta carretera con la que va a Santa Cruz del Valle, dirigiéndonos hacia Mombeltrán y Ávila. [ Mismo inicio que el AV09 El Pico ].","A los 2,5 kms. terminamos de atravesar Mombeltrán y tomamos el desvío a la derecha hacia San Esteban del Valle; en el km. 7,6 cruzaremos San Esteban siguiendo las indicaciones hacia Navarrevisca y Serranillos por la AV-913; en el km. 14,4 seguiremos rectos dejando a la derecha la AV-922 que va a Pedro Bernardo.",Tiene cartel de puerto.,,40.30744,-4.94784,"https://maps.google.es/maps/ms?msa=0&msid=201849215099252397790.0004f8a6ce290d3bce8ef&hl=es&ie=UTF8&t=m&ll=40.276644,-4.991913&spn=0.104773,0.171318&z=12&output=embed"
JA09,GARCÍEZ / JIMENA,Salimos de Garcíez por la A-6104 en dirección a Jimena. Consideramos el inicio de la subida al cruzar el río Cuadros.,"A los 3,9 kms. giramos a la izquierda por la A-320 hacia Jimena; en el km. 6,6 después de cruzar Jimena, seguimos por la derecha por la JA-3105 que nos lleva a Albánchez de Mágina; cruzamos Albánchez y seguimos por la JA-3107 en dirección a Torres.",Tiene cartel de puerto.,,37.78625,-3.48308,"https://maps.google.es/maps/ms?msa=0&msid=218028416192983371638.0004f7b207fee75ba8899&hl=es&ie=UTF8&t=m&ll=37.82226,-3.461037&spn=0.108479,0.171318&z=12&output=embed"
LU01,BALDOMIR / VILAR,"Nos situamos en la LU-4701 que comunica Folgoso do Courel con Vilamor y Froixán. Cuando la carretera cruza el río Lor comienza la ascensión, en dirección hacia Folgoso do Courel.","A los 300 mts. tendremos que girar a la derecha hacia Vidallón y Vilar; en el km. 3,1 seguimos por la derecha hacia Vidallón por la LU-1305; pasaremos junto a Vidallón y Vilar.",Tiene cartel de puerto.,,42.54517,-7.21458,"https://maps.google.es/maps/ms?msa=0&msid=201849215099252397790.0004f78a54dfb42971498&hl=es&ie=UTF8&t=m&ll=42.558138,-7.215443&spn=0.050578,0.085659&z=13&output=embed"
LU01,BALDOMIR,"Nos situamos en la LU-4701 que comunica Folgoso do Courel con Vilamor y Froixán. Cuando la carretera cruza el río Lor comienza la ascensión, en dirección hacia Folgoso do Courel.","A los 300 mts. tendremos que girar a la derecha hacia Vidallón y Vilar; en el km. 3,1 seguimos por la izquierda dejando a la derecha la que va a Vidallón; en el km. 4,5 se alcanza la carretera LU-651 que viene de Folgoso do Courel, y giramos a la derecha hacia Quiroga.",Tiene cartel de puerto.,,42.54517,-7.21458,"https://maps.google.es/maps/ms?msa=0&msid=201849215099252397790.0004f78a4e153167d6b13&hl=es&ie=UTF8&t=m&ll=42.561299,-7.213898&spn=0.050575,0.085659&z=13&output=embed"
AV03,BURGOHONDO,Salimos de Burgohondo hacia Navalmoral por la AV-900.,"Al cruzar el pueblo de Navalmoral, seguir las indicaciones a Ávila y Puerto de Navalmoral por la AV-900.",Tiene cartel de puerto.,,40.49778,-4.73608,"https://maps.google.es/maps/ms?msa=0&msid=201849215099252397790.0004f8a6dc85db7765524&hl=es&ie=UTF8&t=m&ll=40.455307,-4.757767&spn=0.104495,0.171318&z=12&output=embed"
AV12,CL-501,"En la CL-501 entre Piedralaves y Arenas de San Pedro, en el desvío hacia el pueblo de Pedro Bernardo por la AV-922.","Al pasar por Pedro Bernardo hemos de seguir la carretera que traemos, siguiendo las indicaciones a San Esteban del Valle y Serranillos.",Tiene cartel de puerto.,,40.2501,-4.969,"https://maps.google.es/maps/ms?msa=0&msid=201849215099252397790.0004f8a3fbc16a64bbeef&hl=es&ie=UTF8&t=m&ll=40.244681,-4.925995&spn=0.104822,0.171318&z=12&output=embed"
AV10,GAVILANES,"En la CL-501 entre Piedralaves y Arenas de San Pedro, en el desvío hacia Gavilanes y Mijares por la AV-P-705.","Atravesar Mijares siguiendo la carretera principal, después de la Plaza Mayor seguir por la Calle Mayor hasta salir a la carretera AV-901 que de Casavieja va a Burgohondo, girando a la izquierda hacia Burgohondo.",Tiene cartel de puerto.,,40.3315,-4.8138,"https://maps.google.es/maps/ms?msa=0&msid=201849215099252397790.0004f8a52be3dbb0ca7cc&hl=es&ie=UTF8&t=m&ll=40.289478,-4.829865&spn=0.104753,0.171318&z=12&output=embed"
IB13,BUNYOLA,"En la Ma-11 que va de Palma a Sóller, hallaremos el desvío hacia la Ma-2010 que se dirige a Bunyola y Orient. Más adelante, al cruzar el torrent de Bunyola, damos inicio a esta subida. [Mismo inicio que el IB12 Coll de Sóller en su vertiente de Bunyola ]","Cruzaremos Bunyola siguiendo la calle principal hasta llegar a la altura de la iglesia, donde giraremos a la izquierda por la Ma-2100 en dirección a Orient y Alaró.",Tiene cartel de puerto.,,39.72709,2.73147,"https://maps.google.es/maps/ms?msa=0&msid=201849215099252397790.0004f73fd456d24d566c5&hl=es&ie=UTF8&t=m&ll=39.711941,2.707787&spn=0.052821,0.085659&z=13&output=embed"
AV04,SANTA CRUZ DEL VALLE,"En la N-502 entre Ramacastañas y Mombeltrán, tomaremos el desvío hacia Santa Cruz del Valle, y al cruzar el puente sobre el río Ramacastañas comenzamos el ascenso. [ Mismo inicio que el AV09 El Pico ].","Cruzaremos San Esteban siguiendo las indicaciones hacia Navarrevisca y Serranillos por la AV-913; en el km. 7,1 seguiremos rectos dejando a la derecha la AV-922 que va a Pedro Bernardo.",Tiene cartel de puerto.,,40.30744,-4.94784,"https://maps.google.es/maps/ms?msa=0&msid=201849215099252397790.0004f8a6c67dd9827dc0f&hl=es&ie=UTF8&t=m&ll=40.279264,-4.992943&spn=0.104769,0.171318&z=12&output=embed"
TO03,SAN PABLO DE LOS MONTES,"Saliendo de Menasalbas por la TO-7841-V hacia San Pablo de los Montes, iniciaremos la ascensión al cruzar el arroyo de la Jarala, cuando nos quedan unos 6 kms. para llegar a San Pablo de los Montes.",Cruzaremos San Pablo de los Montes por la calle de la Retuerta buscando la salida hacia Los Baños de Robledillo.,Tiene cartel de puerto.,,39.52387,-4.35797,"https://maps.google.es/maps/ms?msa=0&msid=201849215099252397790.0004f8e95920e7afebb8e&hl=es&ie=UTF8&t=m&ll=39.555148,-4.33239&spn=0.105882,0.171318&z=12&output=embed"
CA16,LA HERMIDA,"En la N-612 entre Panes y Potes, al paso por La Hermida, hallaremos el desvío hacia Linares y Puentenansa por la CA-282, al cruzar el río Deva. [ Mismo inicio que el CA13 La Hoja-Salto de La Cabra ]","Cualquier cruce que se nos presente, deberemos tomar siempre hacia Puentenansa.",Tiene cartel de puerto.,,43.24591,-4.54182,"https://maps.google.es/maps/ms?msa=0&msid=201849215099252397790.0004f8d5c2c4785ecbcc5&hl=es&ie=UTF8&t=m&ll=43.250704,-4.577694&spn=0.050013,0.085659&z=13&output=embed"
AT02,XIXONA (FÁBRICA DE TURRÓN),"En la N-340 entre Xixona y Alcoy. El puerto comienza en la localidad de Xixona, justo en el puente sobre un barranco frente a la fábrica de turrones El Lobo.","Cuando llevamos 1,6 kms. llegaremos al cruce de Torremanzanas, seguimos rectos hacia Alcoy.",Tiene cartel de puerto.,,38.60396,-0.48605,"https://maps.google.es/maps/ms?msa=0&msid=201849215099252397790.0004f94aece824873e94c&hl=es&ie=UTF8&t=m&ll=38.57018,-0.498161&spn=0.10737,0.171318&z=12&output=embed"
AN09,ANDORRA LA VELLA,Salimos de Andorra La Vella por la CG-2 que se dirige a Encamp y Canillo.,"Después de 22 kms. por la CG-2, deberemos escoger la antigua carretera del Port d'Envalira evitando la moderna que se mete en un túnel.",Tiene cartel de puerto.,Tráfico molesto.,42.5405,1.71903,"https://maps.google.es/maps/ms?msa=0&msid=201849215099252397790.0004f8e674f4908215efa&hl=es&ie=UTF8&t=m&ll=42.542457,1.61293&spn=0.202362,0.342636&z=11&output=embed"
IB12,BUNYOLA,"En la Ma-11 que va de Palma a Sóller, junto al desvío hacia Bunyola, dirigiéndonos hacia Sóller. [Mismo inicio que el IB13 Coll d'Honor ]","En el km 2,2 continuaremos por la Ma-11 A (antigua C-711) que sale a la izquierda, para evitar el túnel.",Tiene cartel de puerto.,,39.73048,2.68623,https://mapsengine.google.com/map/embed?mid=zjPGjqFDFxZw.k1tONFMjWDdc
IB12,SÓLLER,"Podemos considerar el inicio en la rotonda donde se unen la carretera Ma-10 que viene de Andratx y Deiá, con la que viene del Port de Sóller. Tomamos dirección Palma por la Ma-11.","En el km 3,3 continuaremos por la Ma-11 A (antigua C-711) que sale a la izquierda, para evitar el túnel.",Tiene cartel de puerto.,,39.73048,2.68623,"https://maps.google.es/maps/ms?msa=0&msid=201849215099252397790.0004f73fdee1f64d7e789&hl=es&ie=UTF8&t=m&ll=39.750358,2.70092&spn=0.052792,0.085659&z=13&output=embed"
CA12,SAN ROQUE DE RIOMIERA,Salimos de San Roque de Riomiera tomando la CA-261 hacia Espinosa de los Monteros y el Portillo de Lunada.,"En el km. 1,2 nos desviaremos a la derecha hacia Selaya y Vega de Pas por la CA-264.",Tiene cartel de puerto.,,43.22228,-3.7315,"https://maps.google.es/maps/ms?msa=0&msid=201849215099252397790.0004f8d4eef55b1beca2b&hl=es&ie=UTF8&t=m&ll=43.229383,-3.715439&spn=0.025015,0.04283&z=14&output=embed"
CA06,ARREDONDO,"En Arredondo, saliendo por la CA-261 hacia La Cavada y Solares. [ Mismo inicio que el CA08 Asón-La Sía por Arredondo ]","En el km. 1,7 tomamos a la derecha hacia La Cavada, dejando la que va a Bustablado a la izquierda.",Tiene cartel de puerto.,,43.29957,-3.65109,"https://maps.google.es/maps/ms?msa=0&msid=201849215099252397790.0004f8d398882d3c4f453&hl=es&ie=UTF8&t=m&ll=43.283329,-3.629608&spn=0.049986,0.085659&z=13&output=embed"
CA06,BUSTABLADO,"En Arredondo, saliendo por la CA-261 hacia La Cavada y Solares. [ Mismo inicio que el CA08 Asón-La Sía por Arredondo ]","En el km. 1,7 tomamos a la izquierda hacia Bustablado, dejando la que va a La Cavada a la izquierda; en el km. 4,8 terminamos de cruzar Bustablado y giramos a la derecha, dejando a la izquierda la pista que va a San Roque de Riomiera por el CA18 Collao Espina; en el km. 6,4 alcanzamos la CA-261 que viene de Arredondo, y giramos a la izquierda hacia La Cavada.",Tiene cartel de puerto.,,43.29957,-3.65109,"https://maps.google.es/maps/ms?msa=0&msid=201849215099252397790.0004f8d39ed42423a14cd&hl=es&ie=UTF8&t=m&ll=43.285953,-3.631668&spn=0.049984,0.085659&z=13&output=embed"
BA13,GÓMBREN,Salimos de Gómbren por la GI-402 hacia La Pobla de Lillet cruzando el Torrent de Barruell.,"En el km. 2,4 tomaremos el desvío a la derecha que nos lleva a Montgrony y Castellar de n'Hug; en el km. 4,1 nuevo desvío esta vez a la izquierda, hacia Castellar; y en el km. 12,6 alcanzamos la carretera que viene de La Pobla de Lillet por la izquierda, nosotros giramos a la derecha buscando el final.",Tiene cartel de puerto.,,42.3015,1.9924,"https://maps.google.es/maps/ms?msa=0&msid=201849215099252397790.0004f9ab50905f9bb98e7&hl=es&ie=UTF8&t=m&ll=42.274006,2.027321&spn=0.101615,0.171318&z=12&output=embed"
AV02,PIEDRAHITA,"En Piedrahita, tomamos la AV-932 que se dirige a La Herguijuela.","En el km. 2,6 seguimos rector ignorando la carretera de la derecha que va a Casas de Navarcuenda.",Tiene cartel de puerto.,,40.42225,-5.29876,"https://maps.google.es/maps/ms?msa=0&msid=201849215099252397790.0004f8a6e632940bd12b8&hl=es&ie=UTF8&t=m&ll=40.44146,-5.314293&spn=0.052258,0.085659&z=13&output=embed"
JA09,BEDMAR / JIMENA,"Si circulamos desde Bedmar hacia Jimena por la A-320, podemos considerar el inicio de la subida al cruzar el río Cuadros.","En el km. 3,8 antes de entrar en Jimena dejamos la A-320 y giramos a la izquierda hacia Albánchez de Mágina por la carretera JA-3105; cruzamos Albánchez y seguimos por la JA-3107 en dirección a Torres.",Tiene cartel de puerto.,,37.78625,-3.48308,"https://maps.google.es/maps/ms?msa=0&msid=218028416192983371638.0004f7b20eb4d9e9e9afd&hl=es&ie=UTF8&t=m&ll=37.805715,-3.467216&spn=0.108503,0.171318&z=12&output=embed"
MA10,LA HIRUELA,"Transitando por la carretera que une Colmenar de la Sierra y El Cardoso, en provincia de Guadalajara, hallaremos el desvío hacia el pueblo de La Hiruela, la M-137. Cuando crucemos el puente sobre el río Jarama y entremos en provincia de Madrid damos por iniciada la ascensión. [ Mismo inicio que el GU04 Peñalba por la vertiente de La Hiruela ]","En el km. 3,9 en la entrada de La Hiruela, dejamos la derecha que nos lleva al pueblo y continuamos rectos hacia Montejo de la Sierra y el Puerto de la Hiruela; en el km. 6,0 coronamos el Puerto de La Hiruela, con cartel, y seguimos hacia adelante; en el km. 7,8 tomaremos a la izquierda por la M-811 hacia Puebla de la Sierra y Prádena del Rincón, dejando a la derecha la que va a Montejo de la Sierra; en el km. 9,0 alcanzamos la M-130 que sube de Prádena del Rincón, y continuamos por la izquierda hacia Puebla de la Sierra.",Tiene cartel de puerto.,,41.04015,-3.48016,"https://maps.google.es/maps/ms?msa=0&msid=201849215099252397790.0004f77e057c2ae48235b&hl=es&ie=UTF8&t=m&ll=41.061751,-3.46344&spn=0.103546,0.171318&z=12&output=embed"
LE03,RÍO CABRERA,"En la LE-164 entre Puente de Domingo Flórez y La Baña, iniciamos el ascenso al cruzar el Río Cabrera en dirección hacia La Baña. [ Mismo inicio que el LE07 Piedrafita por la vertiente de Sigüeya y el LE08 Virgen del Valle ]","En el km. 5,6 seguimos recto dejando a la derecha la carretera que va a Benuza.",Tiene cartel de puerto.,,42.29301,-6.67094,"https://maps.google.es/maps/ms?msa=0&msid=201849215099252397790.0004f84a9a0712c3d7533&hl=es&ie=UTF8&t=m&ll=42.342305,-6.687241&spn=0.203009,0.342636&z=11&output=embed"
